{
  "$schema": "https://json-schema.org/draft/2020-12/schema",
  "$id": "https://lambdasistemi.github.io/graph-browser/schema/config.schema.json",
  "title": "Graph Browser Configuration",
  "description": "Configuration for a graph-browser instance: title, source URL, and node kind definitions.",
  "type": "object",
  "required": ["title", "description", "sourceUrl", "kinds"],
  "additionalProperties": false,
  "properties": {
    "title": {
      "type": "string",
      "description": "Display title for the graph. Shown in the sidebar header, browser tab, and used as the localStorage namespace."
    },
    "description": {
      "type": "string",
      "description": "Short description of what this graph covers."
    },
    "sourceUrl": {
      "type": "string",
      "format": "uri",
      "description": "URL to the source repository. Shown as a 'Source' link in the legend. Set to empty string to hide."
    },
    "kinds": {
      "type": "object",
      "description": "Node kind definitions. Keys are kind IDs used in graph.json nodes. Each kind defines how nodes of that type are displayed.",
      "additionalProperties": {
        "type": "object",
        "required": ["label", "color", "shape"],
        "additionalProperties": false,
        "properties": {
          "label": {
            "type": "string",
            "description": "Human-readable label for this kind (e.g. 'Actor', 'Process')."
          },
          "color": {
            "type": "string",
            "pattern": "^#[0-9a-fA-F]{6}$",
            "description": "Hex color for this kind's nodes (e.g. '#58a6ff')."
          },
          "shape": {
            "type": "string",
            "enum": ["ellipse", "round-rectangle", "diamond", "round-hexagon", "rectangle", "round-octagon", "barrel", "round-pentagon", "triangle", "star"],
            "description": "Cytoscape.js node shape."
          }
        }
      }
    },
    "graphSource": {
      "type": "object",
      "description": "Optional legacy single RDF graph payload. Keeps config.json as the entry point while allowing the graph itself to come from RDF instead of graph.json.",
      "$ref": "#/$defs/graphSource"
    },
    "graphSources": {
      "type": "array",
      "description": "Optional ordered list of RDF sources to merge at runtime. Use this when the deployed dataset is split across instance data and ontology files.",
      "minItems": 1,
      "items": {
        "$ref": "#/$defs/graphSource"
      }
    }
  },
  "$defs": {
    "graphSource": {
      "additionalProperties": false,
      "required": ["format", "path"],
      "properties": {
        "format": {
          "type": "string",
          "enum": ["application/n-quads", "nq", "text/turtle", "ttl", "application/ld+json", "jsonld", "application/n-triples", "nt", "application/trig", "trig", "text/n3", "n3", "application/rdf+xml", "rdf"],
          "description": "RDF serialization format understood by the runtime importer."
        },
        "path": {
          "type": "string",
          "description": "Path to the RDF asset relative to the site or raw repository root (for example 'data/rdf/graph.nq')."
        },
        "label": {
          "type": "string",
          "description": "Optional human-readable label shown in the Sources sidebar. Defaults to the path."
        },
        "background": {
          "type": "boolean",
          "description": "When true, this source is always loaded but never appears in the user-facing Sources toggle list and is excluded from Solo mode's hide set. Use for foundational vocab / shared instance data that downstream per-source toggles assume is present. Defaults to false."
        }
      }
    }
  }
}
